{
  "schema_version": 1,
  "ranking_snapshot_id": "01JZRANKSNAP0000000000001",
  "workspace_id": "demo-workspace",
  "trace_id": "trace-ranking-prompt-1",
  "ranking_type": "prompt",
  "scope_ref": "object://writing-runs/01JZWRITING00000000000001",
  "version": 1,
  "updated_at": "2026-07-12T01:34:00Z",
  "items": [
    {
      "rank": 1,
      "target_type": "prompt_version",
      "target_id": "prompt://writer/chapter-default",
      "label": "writer 默认提示",
      "score": 0.83,
      "status": "leading",
      "signal_ids": ["01JZRANKSIG00000000000001"],
      "summary": "质量稳定，但风格线索仍偏显性。"
    },
    {
      "rank": 2,
      "target_type": "prompt_version",
      "target_id": "prompt://writer/chapter-compact",
      "label": "writer 紧凑提示",
      "score": 0.76,
      "status": "watch",
      "signal_ids": ["01JZRANKSIG00000000000002"],
      "summary": "可作为下一轮收紧表达候选。"
    }
  ],
  "signals": [
    {
      "schema_version": 1,
      "signal_id": "01JZRANKSIG00000000000001",
      "workspace_id": "demo-workspace",
      "trace_id": "trace-ranking-prompt-1",
      "ranking_type": "prompt",
      "target_type": "prompt_version",
      "target_id": "prompt://writer/chapter-default",
      "signal_type": "prompt_effectiveness",
      "score": 0.87,
      "weight": 0.7,
      "source": "quality_gate",
      "source_feedback_record_id": "01JZFDBK0000000000000001",
      "summary": "默认 writer prompt 在质量门禁后保留了节奏与可读性。",
      "evidence_refs": ["object://quality-reports/01JZQLTREP000000000000001"],
      "input_refs": ["object://feedback-records/01JZFDBK0000000000000001"],
      "output_refs": ["object://rankings/prompt/signals/01JZRANKSIG00000000000001"],
      "created_at": "2026-07-12T01:30:00Z",
      "updated_at": "2026-07-12T01:30:00Z"
    },
    {
      "schema_version": 1,
      "signal_id": "01JZRANKSIG00000000000002",
      "workspace_id": "demo-workspace",
      "trace_id": "trace-ranking-prompt-1",
      "ranking_type": "prompt",
      "target_type": "prompt_version",
      "target_id": "prompt://writer/chapter-compact",
      "signal_type": "reader_interest",
      "score": 0.72,
      "weight": 0.5,
      "source": "critic",
      "source_feedback_record_id": "01JZFDBK0000000000000002",
      "summary": "批评者认为默认 prompt 对金手指提示过早，紧凑版更适合后续回合。",
      "evidence_refs": ["object://critic-comments/01JZFDBK0000000000000002"],
      "input_refs": ["object://feedback-records/01JZFDBK0000000000000002"],
      "output_refs": ["object://rankings/prompt/signals/01JZRANKSIG00000000000002"],
      "created_at": "2026-07-12T01:31:00Z",
      "updated_at": "2026-07-12T01:31:00Z"
    }
  ],
  "suggestions": [
    {
      "schema_version": 1,
      "suggestion_id": "01JZRANKSUG00000000000001",
      "workspace_id": "demo-workspace",
      "trace_id": "trace-ranking-prompt-1",
      "ranking_type": "prompt",
      "target_scope": "prompt",
      "status": "review_required",
      "summary": "收紧 writer 默认提示中对金手指线索的显性表达。",
      "recommended_action": "切换到 prompt://writer/chapter-compact 进行下一轮写作。",
      "source_signal_ids": ["01JZRANKSIG00000000000002"],
      "promoted_from_feedback_record_id": "01JZFDBK0000000000000002",
      "input_refs": ["object://rankings/prompt/signals/01JZRANKSIG00000000000002"],
      "output_refs": ["object://strategy-suggestions/01JZSTRAT000000000000001"],
      "created_at": "2026-07-12T01:32:00Z",
      "updated_at": "2026-07-12T01:32:00Z",
      "promoted_at": null
    }
  ]
}
